<?xml version="1.0" encoding="UTF-8"?>
<!DOCTYPE Books SYSTEM "b.dtd">
<?xml-stylesheet type="text/xsl" href="e.xsl"?>

<Books>
  <Book>
    <Isbn>0 – 8447 – 768</Isbn>
    <Title>XML in a Nutshell</Title>
    <Author>Harold, Elliotte Rusty</Author>
  </Book>
  <Book>
    <Isbn>978 – 81 – 317 – 6235 – 6</Isbn>
    <Title>Service – Oriented Architecture</Title>
    <Author>Thomas Erl</Author>
  </Book>
  <Book>
    <Isbn>978 – 81 – 317 – 1869 – 8</Isbn>
    <Title>XML and WebServices</Title>
    <Author>Ron Schmelzer</Author>
  </Book>
</Books>


Convert the XML document given in Ex.b into an XHTML document for tabular presentation 
Using  XSLT. 
